{
  "meta": {
    "slug": "cascada-valor-minero",
    "titulo": "Del subsuelo al fondo: cuánto vale realmente el níquel cubano",
    "subtitulo": "Anclaje empírico del multiplicador VAN/in-situ a partir del único activo minero cubano con estudio de factibilidad auditado",
    "version": "1.0.0",
    "actualizado": "2026-07-29",
    "unidad_monetaria": "USD",
    "unidad_magnitud": "millones",
    "nota_metodologica": "Toda cifra etiquetada 'confirmado' procede literalmente de tablas del informe técnico NI 43-101. Las etiquetadas 'calculado' son aritmética derivada de esas tablas, con la fórmula explícita en el campo 'formula'. Las etiquetadas 'estimado' incorporan supuestos externos al informe. Ninguna cifra de este dataset procede de fuentes secundarias.",
    "descripcion": "Este expediente mide la distancia entre dos magnitudes que el debate público suele tratar como si fueran la misma: el valor bruto del contenido metálico que hay en el subsuelo y el valor que ese subsuelo puede llegar a producir de verdad. La primera se obtiene multiplicando toneladas de metal por su precio de mercado y no es un valor de activo. Entre una y otra median la recuperación metalúrgica, el coste operativo, el capital, el descuento temporal y la titularidad.\n\nPara medir esa distancia en lugar de suponerla, el expediente usa el único yacimiento cubano con estudio de factibilidad auditado bajo estándar internacional: el informe técnico NI 43-101 del Moa Joint Venture, redactado por Micon International Co Limited conforme a las definiciones CIM de 2014, con fecha efectiva del 31 de agosto de 2022. El vehículo se constituyó el 1 de diciembre de 1994 y pertenece a partes iguales a Sherritt International, de Canadá, y a General Nickel Company, del Estado cubano, con una regalía del 5 % sobre el valor neto de ventas y una contribución territorial del 1 %.\n\nLa cascada, en base 100 % y a precios del caso base, va de 25.328 millones de dólares de valor bruto de contenido metálico in situ a 812 millones de valor actual neto al 8 % después de impuestos. Los tramos que se pierden por el camino son 10.564 millones por recuperación de mina a metal, 11.026 millones por coste de caja, 1.851 millones por capital de sostenimiento, cierre e impuestos, y 1.075 millones por el descuento temporal sobre 26 años de vida de mina. La participación efectiva del Estado cubano, sumando el 50 % del capital más regalías e impuestos, queda en 888 millones.\n\nDe ahí sale el resultado central. El multiplicador entre valor realizable y valor bruto in situ es del 3,21 % en el caso base y del 4,91 % en el escenario alternativo alcista; medido sobre la toma estatal, del 3,51 % y del 4,57 % respectivamente. El rango recomendado para trasladar cualquier tabla de riqueza in situ a valor realizable es del 3,2 % al 4,9 %, con tres sesgos que deben declararse junto al número. Al alza, porque Moa es el mejor activo minero de Cuba —planta en operación desde 1961, puerto propio, refinería asociada y operador extranjero cotizado— y cualquier otro yacimiento tendrá un multiplicador inferior: la cifra es techo, no valor central. A la baja, porque el valor actual neto se calculó con la red eléctrica cubana deteriorada. Y de acotamiento, porque el resultado es específico de laterita de níquel y cobalto con proceso de lixiviación ácida a presión, y no se traslada a oro ni a tierras raras.\n\nUn hallazgo colateral corrige una cifra de uso corriente: la recuperación real de mina a metal es del 61,2 % en níquel y del 58,8 % en cobalto, no del 85,2 % y el 84,2 % que suelen citarse. Estas últimas son recuperaciones de planta, que miden el rendimiento entre lo que entra a proceso y el metal final, no qué fracción del metal contenido en reservas llega a venderse.\n\nEl inventario geológico advierte además de un error frecuente: los recursos se reportan de forma inclusiva respecto a las reservas, de modo que sumar ambas categorías constituye doble contabilización. Solo las reservas probadas y probables, 117,18 millones de toneladas con 1.182,4 kilotoneladas de níquel contenido y 144 de cobalto, admiten valoración económica.\n\nLa sensibilidad marca el punto de quiebre. Con los precios un 15 % por debajo del caso base, el valor actual neto cae a 11 millones: el umbral de valor cero está en un níquel de 13.340 dólares por tonelada. En el mercado real de 2024 el níquel se sostuvo cerca del caso base, pero el cobalto cotizó a la mitad del supuesto del informe, y el cobalto aporta el 27 % del ingreso bruto del proyecto.\n\nCruzando esas magnitudes está el pasivo externo cubano: 4.795,5 millones de deuda oficial con el Club de París al cierre de 2025 y 19.743 millones de deuda externa total según el último dato general publicado por el Banco Central, que es de 2020. Las reclamaciones patrimoniales por nacionalizaciones siguen sin cuantificación auditada, y su omisión sesga el balance a favor del activo.\n\nLa conclusión es de método antes que de cifra: el argumento a favor de un fondo soberano cubano no puede sostenerse sobre magnitudes de riqueza in situ. El valor de opción sobre reservas no desarrolladas es real y no es cero, pero debe declararse como opción y no como patrimonio disponible. El propio informe incorpora una advertencia de independencia que el expediente mantiene visible: el laboratorio que realizó la mayoría de los ensayos no se considera independiente del Moa Joint Venture, y sus protocolos de control de calidad no incluyen blancos ni materiales de referencia certificados.",
    "narracion": "Las cifras de riqueza mineral que circulan sobre Cuba miden el metal que hay en el subsuelo multiplicado por su precio de mercado. No son valor de activo. Este expediente mide la distancia real usando el único yacimiento cubano con estudio de factibilidad auditado bajo estándar internacional: el informe técnico del Moa Joint Venture, participado a partes iguales por la canadiense Sherritt y el Estado cubano.\n\nDe veinticinco mil trescientos millones de dólares de valor bruto en el subsuelo quedan ochocientos doce millones de valor actual neto después de impuestos. Por el camino se pierden la recuperación metalúrgica, el coste de operación, el capital y el descuento del tiempo. La participación efectiva del Estado cubano son ochocientos ochenta y ocho millones: en torno al tres y medio por ciento del punto de partida.\n\nEse multiplicador es además un techo, porque Moa es el mejor activo minero del país. Y el margen es estrecho: con los precios un quince por ciento por debajo del caso base, el valor cae prácticamente a cero.\n\nLa conclusión no es que el subsuelo no valga nada. Es que la riqueza in situ, por sí sola, no puede sostener el argumento de un fondo soberano."
  },
  "fuente_primaria": {
    "titulo": "NI 43-101 Technical Report for the Mineral Resource and Mineral Reserve Estimate on the Moa Project, Province of Holguin, Cuba",
    "autor_independiente": "Micon International Co Limited",
    "personas_cualificadas": [
      {
        "nombre": "Beatrice Foret",
        "rol": "recursos minerales",
        "afiliacion": "Micon"
      },
      {
        "nombre": "Michiel F. Breed",
        "rol": "reservas minerales",
        "afiliacion": "Micon"
      },
      {
        "nombre": "Christopher Jacobs",
        "rol": "economía minera",
        "afiliacion": "Micon"
      },
      {
        "nombre": "Bryce Reid",
        "rol": "ingeniería química",
        "afiliacion": "Sherritt"
      }
    ],
    "estandar": "CIM Definition Standards 2014 / NI 43-101",
    "fecha_efectiva": "2022-08-31",
    "fecha_informe": "2023-03-31",
    "url": "https://s2.q4cdn.com/343762060/files/doc_downloads/whitepapers/NI-43-101-Moa-JV-Technical-Report-Final-_Final.pdf",
    "advertencia_independencia": "El laboratorio DELABEL, que realizó la mayoría de los ensayos, no se considera independiente del Moa JV. La QP señala que los protocolos QAQC no incluyen blancos ni materiales de referencia certificados, y recomienda reforzarlos.",
    "confianza": "confirmado"
  },
  "titularidad": {
    "vehiculo": "Moa Joint Venture",
    "constituido": "1994-12-01",
    "socios": [
      {
        "nombre": "Sherritt International Corporation",
        "origen": "Canadá",
        "participacion_pct": 50
      },
      {
        "nombre": "General Nickel Company S.A. (GNC)",
        "origen": "Estado cubano",
        "participacion_pct": 50
      }
    ],
    "regalia_pct": 5,
    "contribucion_territorial_pct": 1,
    "base_regalia": "valor neto de ventas FOB puerto de Moa del níquel y cobalto contenidos en sulfuros mixtos",
    "nota": "Toda cifra de este dataset se reporta en base 100% salvo indicación expresa. La participación económica del Estado cubano es una fracción de esas cifras.",
    "confianza": "confirmado"
  },
  "inventario_geologico": {
    "nota_critica": "Los recursos se reportan INCLUSIVOS de las reservas. Sumar ambas categorías constituye doble contabilización. Los recursos inferidos se fijaron como estéril en el cálculo de reservas.",
    "categorias": [
      {
        "categoria": "Reservas probadas",
        "tonelaje_mt": 83.49,
        "ley_ni_pct": 1.02,
        "ley_co_pct": 0.13,
        "metal_ni_kt": 851.8,
        "metal_co_kt": 104.9,
        "confianza": "confirmado",
        "admite_valoracion": true
      },
      {
        "categoria": "Reservas probables",
        "tonelaje_mt": 33.69,
        "ley_ni_pct": 0.98,
        "ley_co_pct": 0.12,
        "metal_ni_kt": 330.6,
        "metal_co_kt": 39.1,
        "confianza": "confirmado",
        "admite_valoracion": true
      },
      {
        "categoria": "Reservas probadas + probables",
        "tonelaje_mt": 117.18,
        "ley_ni_pct": 1.01,
        "ley_co_pct": 0.12,
        "metal_ni_kt": 1182.4,
        "metal_co_kt": 144,
        "confianza": "confirmado",
        "admite_valoracion": true,
        "es_total": true
      },
      {
        "categoria": "Recursos medidos + indicados",